{
  "hacp_version": "v0.1-draft",
  "record_kind": "hacp.stop_response",
  "stop_id": "stop-2026-05-19-reliability-001",
  "packet_id": "packet-2026-05-19-001",
  "report_id": "report-2026-05-19-quickstart-001",
  "stop_reason": "RELIABILITY_LIMIT_REACHED",
  "what_does_not_line_up": "The agent cannot prove final PR readiness because the last thread-aware readback is incomplete.",
  "evidence_refs": [
    "pr/160/checks",
    "pr/160/review-threads"
  ],
  "minimal_correction": "Re-run thread-aware PR checks and review comments before merge or continuation.",
  "authority_context": {
    "authority": "verify_only",
    "forbidden_effects_triggered": []
  },
  "reliability_boundary": {
    "verified_state": [
      "Local docs tests passed.",
      "Branch feat/phase-143 was pushed."
    ],
    "unverified_state": [
      "Final review-bot state was not re-read after the last push.",
      "Merge readiness was not proven from terminal checks."
    ],
    "last_safe_state": {
      "branch": "feat/phase-143",
      "commit": "ec0c328d",
      "pull_request": "https://github.com/example/repo/pull/42"
    },
    "pending_external_state": [
      "Sourcery review",
      "thread-aware GitHub review comments"
    ],
    "recommended_next_action": "Stop and re-run live PR readback before merge.",
    "do_not_continue_based_on_incomplete_readback": true
  }
}
